{
  "contexts": [
    {
      "confidence_bucket": "0.25..0.50",
      "context_key": "BNBUSDT|BUY|aurora|MEAN_REVERSION|0.25..0.50",
      "low_power_reason": "TRAIN_BELOW_DISPLAY_MINIMUM",
      "recommendation": "collect_more_atoms",
      "regime": "MEAN_REVERSION",
      "side": "BUY",
      "strategy_id": "aurora",
      "support_counts": {
        "decay_applied": false,
        "effective_total_count": null,
        "raw_total_count": 1,
        "train_count": 0,
        "validation_count": 1
      },
      "support_quality": "INSUFFICIENT",
      "symbol": "BNBUSDT",
      "timestamp_range": {
        "earliest_atom_ts_ms": 1778589646412,
        "latest_atom_ts_ms": 1778589646412,
        "train_window_end_ts_ms": null,
        "validation_window_start_ts_ms": 1778589646412
      },
      "train_count": 0,
      "train_net_score": 0.0,
      "train_outcomes": {},
      "train_rates": {
        "favorable_rate": 0.0,
        "negative_rate": 0.0,
        "policy_too_strict_rate": 0.0
      },
      "validation_count": 1,
      "validation_net_score": 32.909634,
      "validation_outcomes": {},
      "validation_rates": {
        "favorable_rate": 0.0,
        "negative_rate": 0.0,
        "policy_too_strict_rate": 0.0
      },
      "validation_reason": "train_or_validation_support_below_threshold",
      "validation_result": "SKIPPED_LOW_SUPPORT",
      "verdict": "LOW_SUPPORT"
    },
    {
      "confidence_bucket": "0.25..0.50",
      "context_key": "BNBUSDT|BUY|aurora|TREND_UP|0.25..0.50",
      "low_power_reason": "TRAIN_BELOW_DISPLAY_MINIMUM",
      "recommendation": "collect_more_atoms",
      "regime": "TREND_UP",
      "side": "BUY",
      "strategy_id": "aurora",
      "support_counts": {
        "decay_applied": false,
        "effective_total_count": null,
        "raw_total_count": 3,
        "train_count": 1,
        "validation_count": 2
      },
      "support_quality": "INSUFFICIENT",
      "symbol": "BNBUSDT",
      "timestamp_range": {
        "earliest_atom_ts_ms": 1778539967451,
        "latest_atom_ts_ms": 1778846706947,
        "train_window_end_ts_ms": 1778539967451,
        "validation_window_start_ts_ms": 1778808697557
      },
      "train_count": 1,
      "train_net_score": 59.94896,
      "train_outcomes": {
        "GOOD_DECISION": 1
      },
      "train_rates": {
        "favorable_rate": 1.0,
        "negative_rate": 0.0,
        "policy_too_strict_rate": 0.0
      },
      "validation_count": 2,
      "validation_net_score": -28.026722,
      "validation_outcomes": {},
      "validation_rates": {
        "favorable_rate": 0.0,
        "negative_rate": 0.0,
        "policy_too_strict_rate": 0.0
      },
      "validation_reason": "train_or_validation_support_below_threshold",
      "validation_result": "SKIPPED_LOW_SUPPORT",
      "verdict": "LOW_SUPPORT"
    },
    {
      "confidence_bucket": "0.25..0.50",
      "context_key": "BNBUSDT|SELL|aurora|MEAN_REVERSION|0.25..0.50",
      "low_power_reason": "TRAIN_BELOW_DISPLAY_MINIMUM",
      "recommendation": "collect_more_atoms",
      "regime": "MEAN_REVERSION",
      "side": "SELL",
      "strategy_id": "aurora",
      "support_counts": {
        "decay_applied": false,
        "effective_total_count": null,
        "raw_total_count": 2,
        "train_count": 1,
        "validation_count": 1
      },
      "support_quality": "INSUFFICIENT",
      "symbol": "BNBUSDT",
      "timestamp_range": {
        "earliest_atom_ts_ms": 1778560820798,
        "latest_atom_ts_ms": 1778823104605,
        "train_window_end_ts_ms": 1778560820798,
        "validation_window_start_ts_ms": 1778823104605
      },
      "train_count": 1,
      "train_net_score": -2.260943,
      "train_outcomes": {
        "CLEAN_LOSS": 1
      },
      "train_rates": {
        "favorable_rate": 0.0,
        "negative_rate": 1.0,
        "policy_too_strict_rate": 0.0
      },
      "validation_count": 1,
      "validation_net_score": -26.324304,
      "validation_outcomes": {},
      "validation_rates": {
        "favorable_rate": 0.0,
        "negative_rate": 0.0,
        "policy_too_strict_rate": 0.0
      },
      "validation_reason": "train_or_validation_support_below_threshold",
      "validation_result": "SKIPPED_LOW_SUPPORT",
      "verdict": "LOW_SUPPORT"
    },
    {
      "confidence_bucket": "0.50..0.75",
      "context_key": "BNBUSDT|SELL|aurora|MEAN_REVERSION|0.50..0.75",
      "low_power_reason": "TRAIN_BELOW_DISPLAY_MINIMUM",
      "recommendation": "collect_more_atoms",
      "regime": "MEAN_REVERSION",
      "side": "SELL",
      "strategy_id": "aurora",
      "support_counts": {
        "decay_applied": false,
        "effective_total_count": null,
        "raw_total_count": 1,
        "train_count": 0,
        "validation_count": 1
      },
      "support_quality": "INSUFFICIENT",
      "symbol": "BNBUSDT",
      "timestamp_range": {
        "earliest_atom_ts_ms": 1778568668254,
        "latest_atom_ts_ms": 1778568668254,
        "train_window_end_ts_ms": null,
        "validation_window_start_ts_ms": 1778568668254
      },
      "train_count": 0,
      "train_net_score": 0.0,
      "train_outcomes": {},
      "train_rates": {
        "favorable_rate": 0.0,
        "negative_rate": 0.0,
        "policy_too_strict_rate": 0.0
      },
      "validation_count": 1,
      "validation_net_score": 13.188436,
      "validation_outcomes": {},
      "validation_rates": {
        "favorable_rate": 0.0,
        "negative_rate": 0.0,
        "policy_too_strict_rate": 0.0
      },
      "validation_reason": "train_or_validation_support_below_threshold",
      "validation_result": "SKIPPED_LOW_SUPPORT",
      "verdict": "LOW_SUPPORT"
    },
    {
      "confidence_bucket": "0.00..0.25",
      "context_key": "BNBUSDT|SELL|aurora|TREND_DOWN|0.00..0.25",
      "low_power_reason": "TRAIN_BELOW_DISPLAY_MINIMUM",
      "recommendation": "collect_more_atoms",
      "regime": "TREND_DOWN",
      "side": "SELL",
      "strategy_id": "aurora",
      "support_counts": {
        "decay_applied": false,
        "effective_total_count": null,
        "raw_total_count": 2,
        "train_count": 1,
        "validation_count": 1
      },
      "support_quality": "INSUFFICIENT",
      "symbol": "BNBUSDT",
      "timestamp_range": {
        "earliest_atom_ts_ms": 1778595375706,
        "latest_atom_ts_ms": 1778826429582,
        "train_window_end_ts_ms": 1778595375706,
        "validation_window_start_ts_ms": 1778826429582
      },
      "train_count": 1,
      "train_net_score": -17.353488,
      "train_outcomes": {
        "CLEAN_LOSS": 1
      },
      "train_rates": {
        "favorable_rate": 0.0,
        "negative_rate": 1.0,
        "policy_too_strict_rate": 0.0
      },
      "validation_count": 1,
      "validation_net_score": -35.459945,
      "validation_outcomes": {},
      "validation_rates": {
        "favorable_rate": 0.0,
        "negative_rate": 0.0,
        "policy_too_strict_rate": 0.0
      },
      "validation_reason": "train_or_validation_support_below_threshold",
      "validation_result": "SKIPPED_LOW_SUPPORT",
      "verdict": "LOW_SUPPORT"
    },
    {
      "confidence_bucket": "0.00..0.25",
      "context_key": "BTCUSDT|BUY|aurora|LOW_VOLATILITY|0.00..0.25",
      "low_power_reason": "TRAIN_BELOW_DISPLAY_MINIMUM",
      "recommendation": "collect_more_atoms",
      "regime": "LOW_VOLATILITY",
      "side": "BUY",
      "strategy_id": "aurora",
      "support_counts": {
        "decay_applied": false,
        "effective_total_count": null,
        "raw_total_count": 3,
        "train_count": 1,
        "validation_count": 2
      },
      "support_quality": "INSUFFICIENT",
      "symbol": "BTCUSDT",
      "timestamp_range": {
        "earliest_atom_ts_ms": 1778590200970,
        "latest_atom_ts_ms": 1778724002020,
        "train_window_end_ts_ms": 1778590200970,
        "validation_window_start_ts_ms": 1778706303706
      },
      "train_count": 1,
      "train_net_score": 31.1946,
      "train_outcomes": {
        "POLICY_PROTECTED": 1
      },
      "train_rates": {
        "favorable_rate": 1.0,
        "negative_rate": 0.0,
        "policy_too_strict_rate": 0.0
      },
      "validation_count": 2,
      "validation_net_score": 6.398809,
      "validation_outcomes": {},
      "validation_rates": {
        "favorable_rate": 0.0,
        "negative_rate": 0.0,
        "policy_too_strict_rate": 0.0
      },
      "validation_reason": "train_or_validation_support_below_threshold",
      "validation_result": "SKIPPED_LOW_SUPPORT",
      "verdict": "LOW_SUPPORT"
    },
    {
      "confidence_bucket": "0.25..0.50",
      "context_key": "BTCUSDT|BUY|aurora|LOW_VOLATILITY|0.25..0.50",
      "low_power_reason": "NONE",
      "recommendation": "retain_or_promote",
      "regime": "LOW_VOLATILITY",
      "side": "BUY",
      "strategy_id": "aurora",
      "support_counts": {
        "decay_applied": false,
        "effective_total_count": null,
        "raw_total_count": 12,
        "train_count": 6,
        "validation_count": 6
      },
      "support_quality": "SUFFICIENT",
      "symbol": "BTCUSDT",
      "timestamp_range": {
        "earliest_atom_ts_ms": 1778531701297,
        "latest_atom_ts_ms": 1778837402783,
        "train_window_end_ts_ms": 1778722204486,
        "validation_window_start_ts_ms": 1778722800105
      },
      "train_count": 6,
      "train_net_score": 5.773558,
      "train_outcomes": {
        "POLICY_PROTECTED": 5,
        "POLICY_TOO_STRICT": 1
      },
      "train_rates": {
        "favorable_rate": 0.833333,
        "negative_rate": 0.0,
        "policy_too_strict_rate": 0.166667
      },
      "validation_count": 6,
      "validation_net_score": 3.948269,
      "validation_outcomes": {
        "POLICY_PROTECTED": 4,
        "POLICY_TOO_STRICT": 2
      },
      "validation_rates": {
        "favorable_rate": 0.666667,
        "negative_rate": 0.0,
        "policy_too_strict_rate": 0.333333
      },